<?xml version="1.0" encoding="UTF-8"?>
<users xmlns:xsi="http://www.w3.org/2001/XMLSchema-instance" xsi:noNamespaceSchemaLocation="usersAuthenticationSchema.xsd">
  <user>
    <id>1</id>
    <name>Ahmed</name>
    <email>ahmad.esam1231998@gmail.com</email>
    <phone>01015328933</phone>
    <password>12345678</password>
    <gender>m</gender>
    <role>instructor</role>
    <class>L1</class>
  </user>
  <user>
    <id>2</id>
    <name>Mohamed</name>
    <email>mohamed.esam1231998@gmail.com</email>
    <phone>01015328930</phone>
    <password>12345678</password>
    <gender>m</gender>
    <role>student</role>
    <class>L1</class>
    <attendanceDates>
      <date>2024-03-12</date>
      <status>present</status>
    </attendanceDates>
    <attendanceDates>
      <date>2024-04-12</date>
      <status>present</status>
    </attendanceDates>
    <attendanceDates>
      <date>2024-02-28</date>
      <status>absent</status>
    </attendanceDates>
    <attendanceDates>
      <date>2024-02-29</date>
      <status>absent</status>
    </attendanceDates>
    <attendanceDates>
      <date>2024-03-01</date>
      <status>absent</status>
    </attendanceDates>
  </user>
  <user>
    <id>3</id>
    <name>Abdo</name>
    <email>abdo.osama123@gmail.com</email>
    <phone>01125488751</phone>
    <password>12345678</password>
    <gender>m</gender>
    <role>admin</role>
  </user>
  <user>
    <id>4</id>
    <name>Habiba</name>
    <email>habiba122@gmail.com</email>
    <phone>01254882366</phone>
    <password>12345678</password>
    <gender>f</gender>
    <role>admin</role>
  </user>
  <user>
    <id>5</id>
    <name>amina</name>
    <email>amina@gmail.com</email>
    <phone>01020228030</phone>
    <password>1234567aa#</password>
    <gender>f</gender>
    <role>student</role>
    <class>R1</class>
    <attendanceDates>
      <date>2024-02-29</date>
      <status>absent</status>
    </attendanceDates>
    <attendanceDates>
      <date>2024-03-01</date>
      <status>absent</status>
    </attendanceDates>
  </user>
  <user>
    <id>6</id>
    <name>ahmed</name>
    <email>ahmedE@gmail.com</email>
    <phone>01020228030</phone>
    <password>123456789aa#</password>
    <gender>m</gender>
    <role>student</role>
    <class>Q1</class>
  </user>
  <user>
    <id>7</id>
    <name>ahmed</name>
    <email>ahmedE1@gmail.com</email>
    <phone>01020228030</phone>
    <password>123456789aa#</password>
    <gender>m</gender>
    <role>student</role>
    <class>C1</class>
  </user>
  <user>
    <id>8</id>
    <name>esraa</name>
    <email>esraa@gmail.com</email>
    <phone>01020228030</phone>
    <password>1234567aa#</password>
    <gender>f</gender>
    <role>student</role>
    <class>Z1</class>
  </user>
  <user>
    <id>9</id>
    <name>soha</name>
    <email>soha@gmail.com</email>
    <phone>01020228030</phone>
    <password>1234567aa#</password>
    <gender>f</gender>
    <role>student</role>
    <class>C1</class>
  </user>
  <user>
    <id>10</id>
    <name>shimaa</name>
    <email>shimaa@gmail.com</email>
    <phone>01020228030</phone>
    <password>1234567aa#</password>
    <gender>f</gender>
    <role>student</role>
    <class>C1</class>
  </user>
  <user>
    <id>11</id>
    <name>nasr</name>
    <email>nasr@gmail.com</email>
    <phone>01020228030</phone>
    <password>1234567aa#</password>
    <gender>f</gender>
    <role>student</role>
    <class>C1</class>
  </user>
</users>